<?xml version="1.0" encoding="UTF-8"?>
<root xmlns:xsi="http://www.w3.org/2001/XMLSchema-instance"
    xsi:noNamespaceSchemaLocation="pepper_loans.xsd">
    <Field_type>
        <FT_0>bool</FT_0>
        <FT_1>date</FT_1>
        <FT_2>float</FT_2>
        <FT_3>int</FT_3>
        <FT_4>str</FT_4>
    </Field_type>
    <Remarks>
        <R1> Benefit of Doubt </R1>
    </Remarks>
    <Lenders>
        <Flexi_up_to_20K>
            <Asset_Type Reference_field="asset_type" Rule_Operator="in" Field_Type="4"
                Rule_Value="Agricultural machinery and equipment, Materials handling/forklifts, Access equipment (boom/scissor lifts), Light trucks &lt;3.5 tonnes, Heavy trucks &gt;3.5 tonnes, TRAILERS, BUSES AND COACHES, Commercial Motor_Vehicles (utes, vans and 4WDs), Construction and earth moving equipment (non-mining)">
                <Flow_Exception_for_True Condition_to_proceed="true"
                    Remark="The asset is listed as an eligible asset." />
                <Flow_Exception_for_False Condition_to_proceed="false"
                    Remark="There are no applicable asset categories for this asset. Consequently, checking the 'Excluded asset list'.">
                    <Exception_rule Reference_field="asset_type" Rule_Operator="not in"
                        Field_Type="4" Rule_Value="Passenger cars, SUVs">
                        <Flow_Exception_for_True
                            Remark="The asset is not listed as excluded on any applicable list. As a result, it will be given the benefit of the doubt for additional evaluation." />
                        <Flow_Exception_for_False
                            Remark="The asset qualifies in excluded asset list and will not be considered for further assessment." />
                    </Exception_rule>
                </Flow_Exception_for_False>
            </Asset_Type>

            <ABN_Registration Reference_field="ABN_in_Months" Rule_Operator="&gt;=" Rule_Value="24"
                Field_Type="3">
                <Flow_Exception_for_True Condition_to_proceed="true"
                    Remark="The borrower meets the age requirement of ABN for the relevant asset categories." />
                <Flow_Exception_for_False Condition_to_proceed="false"
                    Remark="The borrower does not meet the age requirement of ABN for the relevant asset categories." />
            </ABN_Registration>

            <GST_Registration Reference_field="GST_in_Months" Rule_Operator="&gt;=" Rule_Value="0"
                Field_Type="3">
                <Flow_Exception_for_True Condition_to_proceed="true"
                    Remark="The borrower business meets the age requirement of GST for the relevant asset categories." />
                <Flow_Exception_for_False Condition_to_proceed="false"
                    Remark="The borrower business does not meet the age requirement of GST for the relevant asset categories." />
            </GST_Registration>

            <Loan_Amount Reference_field="amount_financed" Rule_Operator="&lt;=" Rule_Value="20000"
                Field_Type="3" logical_operator="and">
                <Logical_Rule Reference_field="amount_financed" Rule_Operator="&gt;" Rule_Value="0"
                    Field_Type="3" />
                <Flow_Exception_for_True Condition_to_proceed="true"
                    Remark="The loan limit meets the criteria for the relevant asset categories." />
                <Flow_Exception_for_False Condition_to_proceed="false"
                    Remark="The loan limit does not meet the criteria for loan range for the relevant asset categories." />
            </Loan_Amount>
        </Flexi_up_to_20K>


    </Lenders>


</root>